<?xml version="1.0"?>
<?xml-stylesheet type="text/xsl" href="style.xsl" ?>
<mentors xmlns:xsi="http://www.w3.org/2001/XMLSchema-instance"
 xsi:noNamespaceSchemaLocation="schemastructure.xsd">

    <mentor id="1">
        <name>Dr. Sundeep Sood</name>
        <designation>Head of Dept.</designation>
        <subjects>C, Ds, Cloud</subjects>
        <yearsOfExp>10</yearsOfExp>
    </mentor>
    <mentor id="2">
        <name>Dr. Munish Bhatia</name>
        <designation>Assistant Professor</designation>
        <subjects>Cn, Iwt, OS</subjects>
        <yearsOfExp>8</yearsOfExp>
    </mentor>
    <mentor id="3">
        <name>Prof. Anhsu Parashar</name>
        <designation>Assistant Proffessor</designation>
        <subjects>DBMS, AI, DAA</subjects>
        <yearsOfExp>9</yearsOfExp>
    </mentor>
    <mentor id="4">
        <name>Dr. Sarika jain</name>
        <designation>Professor</designation>
        <subjects>DM, COA, SE</subjects>
        <yearsOfExp>12</yearsOfExp>
    </mentor>
    <mentor id="5">
        <name>Dr. Kapil Gupta</name>
        <designation>Assistant proffessor</designation>
        <subjects>Python,DA,Java</subjects>
        <yearsOfExp>1</yearsOfExp>
    </mentor>
</mentors> 